{
  "id": "gim-taeryong-1934",
  "name": "김태룡",
  "birth_year": 1934,
  "external_ids": {
    "assembly_mona_cd": "9XN6525K"
  },
  "career": [
    {
      "text": "신한민주당충남제2지구당위원장",
      "from": null,
      "to": null,
      "source_urls": [
        "http://info.nec.go.kr/electioninfo/electionInfo_report.xhtml?electionId=0000000000&requestURI=%2Felectioninfo%2F0000000000%2Fep%2Fepei01.jsp&topMenuId=EP&secondMenuId=EPEI01&menuId=EPEI01&statementId=EPEI01_%2391&oldElectionType=0&electionType=2&electionName=19850212&electionCode=2&cityCode=44&proportionalRepresentationCode=-1&townCode=-1&sggCityCode=-1&x=0&y=0"
      ]
    },
    {
      "text": "신민당중앙상무위원",
      "from": null,
      "to": null,
      "source_urls": [
        "http://info.nec.go.kr/electioninfo/electionInfo_report.xhtml?electionId=0000000000&requestURI=%2Felectioninfo%2F0000000000%2Fep%2Fepei01.jsp&topMenuId=EP&secondMenuId=EPEI01&menuId=EPEI01&statementId=EPEI01_%2391&oldElectionType=0&electionType=2&electionName=19850212&electionCode=2&cityCode=44&proportionalRepresentationCode=-1&townCode=-1&sggCityCode=-1&x=0&y=0"
      ]
    }
  ],
  "education": [
    {
      "text": "충남대법학과 졸",
      "from": null,
      "to": null,
      "source_urls": [
        "http://info.nec.go.kr/electioninfo/electionInfo_report.xhtml?electionId=0000000000&requestURI=%2Felectioninfo%2F0000000000%2Fep%2Fepei01.jsp&topMenuId=EP&secondMenuId=EPEI01&menuId=EPEI01&statementId=EPEI01_%2391&oldElectionType=0&electionType=2&electionName=19850212&electionCode=2&cityCode=44&proportionalRepresentationCode=-1&townCode=-1&sggCityCode=-1&x=0&y=0"
      ]
    }
  ],
  "source_urls": [
    "https://open.assembly.go.kr/portal/data/service/selectServicePage.do/OOWY4R001216HX11439"
  ],
  "verified": false,
  "checked_at": "2026-10-22"
}
