{
  "id": "gang-hunsik-1973",
  "name": "강훈식",
  "birth_year": 1973,
  "external_ids": {
    "assembly_mona_cd": "TRE2429O",
    "nec_huboids": [
      "100152910"
    ]
  },
  "career": [],
  "education": [],
  "source_urls": [
    "https://www.data.go.kr/data/15000864/openapi.do"
  ],
  "verified": false,
  "checked_at": "2026-10-21"
}
