{
  "id": "ju-seongyeong-1958",
  "name": "주성영",
  "birth_year": 1958,
  "external_ids": {
    "assembly_mona_cd": "EWR39555"
  },
  "career": [
    {
      "text": "대구 고등검찰청 부장검사 /",
      "from": null,
      "to": null,
      "source_urls": [
        "http://info.nec.go.kr/electioninfo/electionInfo_report.xhtml?electionId=0000000000&requestURI=%2Felectioninfo%2F0000000000%2Fep%2Fepei01.jsp&topMenuId=EP&secondMenuId=EPEI01&menuId=EPEI01&statementId=EPEI01_%2391&oldElectionType=0&electionType=2&electionName=20040415&electionCode=2&cityCode=27&proportionalRepresentationCode=-1&townCode=-1&sggCityCode=-1&x=0&y=0"
      ]
    },
    {
      "text": "대구고등검찰청 부장검사",
      "from": null,
      "to": null,
      "source_urls": [
        "http://info.nec.go.kr/electioninfo/electionInfo_report.xhtml?electionId=0000000000&requestURI=%2Felectioninfo%2F0000000000%2Fep%2Fepei01.jsp&topMenuId=EP&secondMenuId=EPEI01&menuId=EPEI01&statementId=EPEI01_%231&oldElectionType=1&electionType=2&electionName=20080409&electionCode=2&cityCode=2700&proportionalRepresentationCode=-1&townCode=-1&sggCityCode=-1&x=0&y=0"
      ]
    },
    {
      "text": "한나라당 원내부대표",
      "from": null,
      "to": null,
      "source_urls": [
        "http://info.nec.go.kr/electioninfo/electionInfo_report.xhtml?electionId=0000000000&requestURI=%2Felectioninfo%2F0000000000%2Fep%2Fepei01.jsp&topMenuId=EP&secondMenuId=EPEI01&menuId=EPEI01&statementId=EPEI01_%231&oldElectionType=1&electionType=2&electionName=20080409&electionCode=2&cityCode=2700&proportionalRepresentationCode=-1&townCode=-1&sggCityCode=-1&x=0&y=0"
      ]
    }
  ],
  "education": [
    {
      "text": "고려대학교 법학과 졸업",
      "from": null,
      "to": null,
      "source_urls": [
        "http://info.nec.go.kr/electioninfo/electionInfo_report.xhtml?electionId=0000000000&requestURI=%2Felectioninfo%2F0000000000%2Fep%2Fepei01.jsp&topMenuId=EP&secondMenuId=EPEI01&menuId=EPEI01&statementId=EPEI01_%231&oldElectionType=1&electionType=2&electionName=20080409&electionCode=2&cityCode=2700&proportionalRepresentationCode=-1&townCode=-1&sggCityCode=-1&x=0&y=0",
        "http://info.nec.go.kr/electioninfo/electionInfo_report.xhtml?electionId=0000000000&requestURI=%2Felectioninfo%2F0000000000%2Fep%2Fepei01.jsp&topMenuId=EP&secondMenuId=EPEI01&menuId=EPEI01&statementId=EPEI01_%2391&oldElectionType=0&electionType=2&electionName=20040415&electionCode=2&cityCode=27&proportionalRepresentationCode=-1&townCode=-1&sggCityCode=-1&x=0&y=0"
      ]
    }
  ],
  "source_urls": [
    "https://open.assembly.go.kr/portal/data/service/selectServicePage.do/OOWY4R001216HX11439"
  ],
  "verified": false,
  "checked_at": "2026-10-22"
}
