{
  "id": "gim-byeongyun-1922",
  "name": "김병윤",
  "birth_year": 1922,
  "external_ids": {
    "assembly_mona_cd": "K885191J"
  },
  "career": [
    {
      "text": "포항수산대학장 /",
      "from": null,
      "to": null,
      "source_urls": [
        "http://info.nec.go.kr/electioninfo/electionInfo_report.xhtml?electionId=0000000000&requestURI=%2Felectioninfo%2F0000000000%2Fep%2Fepei01.jsp&topMenuId=EP&secondMenuId=EPEI01&menuId=EPEI01&statementId=EPEI01_%2391&oldElectionType=0&electionType=2&electionName=19710525&electionCode=2&cityCode=47&proportionalRepresentationCode=-1&townCode=-1&sggCityCode=-1&x=0&y=0"
      ]
    }
  ],
  "education": [
    {
      "text": "대졸",
      "from": null,
      "to": null,
      "source_urls": [
        "http://info.nec.go.kr/electioninfo/electionInfo_report.xhtml?electionId=0000000000&requestURI=%2Felectioninfo%2F0000000000%2Fep%2Fepei01.jsp&topMenuId=EP&secondMenuId=EPEI01&menuId=EPEI01&statementId=EPEI01_%2391&oldElectionType=0&electionType=2&electionName=19710525&electionCode=2&cityCode=47&proportionalRepresentationCode=-1&townCode=-1&sggCityCode=-1&x=0&y=0"
      ]
    }
  ],
  "source_urls": [
    "https://open.assembly.go.kr/portal/data/service/selectServicePage.do/OOWY4R001216HX11439"
  ],
  "verified": false,
  "checked_at": "2026-10-22"
}
