{
  "id": "i-yeonguk-1932",
  "name": "이영욱",
  "birth_year": 1932,
  "external_ids": {
    "assembly_mona_cd": "TN556862"
  },
  "career": [
    {
      "text": "법무부 차관",
      "from": null,
      "to": null,
      "source_urls": [
        "http://info.nec.go.kr/electioninfo/electionInfo_report.xhtml?electionId=0000000000&requestURI=%2Felectioninfo%2F0000000000%2Fep%2Fepei01.jsp&topMenuId=EP&secondMenuId=EPEI01&menuId=EPEI01&statementId=EPEI01_%2391&oldElectionType=0&electionType=2&electionName=19850212&electionCode=7&cityCode=-1&proportionalRepresentationCode=-1&townCode=-1&sggCityCode=-1&x=0&y=0"
      ]
    },
    {
      "text": "법무연수원장",
      "from": null,
      "to": null,
      "source_urls": [
        "http://info.nec.go.kr/electioninfo/electionInfo_report.xhtml?electionId=0000000000&requestURI=%2Felectioninfo%2F0000000000%2Fep%2Fepei01.jsp&topMenuId=EP&secondMenuId=EPEI01&menuId=EPEI01&statementId=EPEI01_%2391&oldElectionType=0&electionType=2&electionName=19850212&electionCode=7&cityCode=-1&proportionalRepresentationCode=-1&townCode=-1&sggCityCode=-1&x=0&y=0"
      ]
    }
  ],
  "education": [
    {
      "text": "서울대 법대",
      "from": null,
      "to": null,
      "source_urls": [
        "http://info.nec.go.kr/electioninfo/electionInfo_report.xhtml?electionId=0000000000&requestURI=%2Felectioninfo%2F0000000000%2Fep%2Fepei01.jsp&topMenuId=EP&secondMenuId=EPEI01&menuId=EPEI01&statementId=EPEI01_%2391&oldElectionType=0&electionType=2&electionName=19850212&electionCode=7&cityCode=-1&proportionalRepresentationCode=-1&townCode=-1&sggCityCode=-1&x=0&y=0"
      ]
    }
  ],
  "source_urls": [
    "https://open.assembly.go.kr/portal/data/service/selectServicePage.do/OOWY4R001216HX11439"
  ],
  "verified": false,
  "checked_at": "2026-10-22"
}
