{
  "id": "u-mun-1903",
  "name": "우문",
  "birth_year": 1903,
  "external_ids": {
    "assembly_mona_cd": "KLL2923Z"
  },
  "career": [],
  "education": [],
  "source_urls": [
    "https://open.assembly.go.kr/portal/data/service/selectServicePage.do/OOWY4R001216HX11439"
  ],
  "verified": false,
  "checked_at": "2026-10-22"
}
