{
  "id": "guk-jongnam-1937",
  "name": "국종남",
  "birth_year": 1937,
  "external_ids": {
    "assembly_mona_cd": "NSK21294"
  },
  "career": [],
  "education": [],
  "source_urls": [
    "https://open.assembly.go.kr/portal/data/service/selectServicePage.do/OOWY4R001216HX11439"
  ],
  "verified": false,
  "checked_at": "2026-10-22"
}
