{
  "id": "sin-jaehyu-1936",
  "name": "신재휴",
  "birth_year": 1936,
  "external_ids": {
    "assembly_mona_cd": "4W399763"
  },
  "career": [],
  "education": [],
  "source_urls": [
    "https://open.assembly.go.kr/portal/data/service/selectServicePage.do/OOWY4R001216HX11439"
  ],
  "verified": false,
  "checked_at": "2026-10-22"
}
