{
  "id": "yu-simin-1959",
  "name": "유시민",
  "birth_year": 1959,
  "external_ids": {
    "assembly_mona_cd": "XFH9918T"
  },
  "career": [
    {
      "text": "개혁국민정당 대표집행위원",
      "from": null,
      "to": null,
      "source_urls": [
        "http://info.nec.go.kr/electioninfo/electionInfo_report.xhtml?electionId=0000000000&requestURI=%2Felectioninfo%2F0000000000%2Fep%2Fepei01.jsp&topMenuId=EP&secondMenuId=EPEI01&menuId=EPEI01&statementId=EPEI01_%2391&oldElectionType=0&electionType=2&electionName=20040415&electionCode=2&cityCode=41&proportionalRepresentationCode=-1&townCode=-1&sggCityCode=-1&x=0&y=0"
      ]
    },
    {
      "text": "열린우리당 경기도지부장",
      "from": null,
      "to": null,
      "source_urls": [
        "http://info.nec.go.kr/electioninfo/electionInfo_report.xhtml?electionId=0000000000&requestURI=%2Felectioninfo%2F0000000000%2Fep%2Fepei01.jsp&topMenuId=EP&secondMenuId=EPEI01&menuId=EPEI01&statementId=EPEI01_%2391&oldElectionType=0&electionType=2&electionName=20040415&electionCode=2&cityCode=41&proportionalRepresentationCode=-1&townCode=-1&sggCityCode=-1&x=0&y=0"
      ]
    }
  ],
  "education": [
    {
      "text": "서울대학교 경제학과 졸업",
      "from": null,
      "to": null,
      "source_urls": [
        "http://info.nec.go.kr/electioninfo/electionInfo_report.xhtml?electionId=0000000000&requestURI=%2Felectioninfo%2F0000000000%2Fep%2Fepei01.jsp&topMenuId=EP&secondMenuId=EPEI01&menuId=EPEI01&statementId=EPEI01_%2391&oldElectionType=0&electionType=2&electionName=20040415&electionCode=2&cityCode=41&proportionalRepresentationCode=-1&townCode=-1&sggCityCode=-1&x=0&y=0"
      ]
    }
  ],
  "source_urls": [
    "https://open.assembly.go.kr/portal/data/service/selectServicePage.do/OOWY4R001216HX11439"
  ],
  "verified": false,
  "checked_at": "2026-10-22"
}
