{
  "id": "han-huiseok-1909",
  "name": "한희석",
  "birth_year": 1909,
  "external_ids": {
    "assembly_mona_cd": "OQO9849Q"
  },
  "career": [],
  "education": [],
  "source_urls": [
    "https://open.assembly.go.kr/portal/data/service/selectServicePage.do/OOWY4R001216HX11439"
  ],
  "verified": false,
  "checked_at": "2026-10-22"
}
