{
  "id": "gim-beoprin-1899",
  "name": "김법린",
  "birth_year": 1899,
  "external_ids": {
    "assembly_mona_cd": "AH95654W"
  },
  "career": [],
  "education": [],
  "source_urls": [
    "https://open.assembly.go.kr/portal/data/service/selectServicePage.do/OOWY4R001216HX11439"
  ],
  "verified": false,
  "checked_at": "2026-10-22"
}
