{
  "id": "jo-namcheol-1923",
  "name": "조남철",
  "birth_year": 1923,
  "external_ids": {
    "assembly_mona_cd": "1L75529M"
  },
  "career": [],
  "education": [],
  "source_urls": [
    "https://open.assembly.go.kr/portal/data/service/selectServicePage.do/OOWY4R001216HX11439"
  ],
  "verified": false,
  "checked_at": "2026-10-22"
}
