{
  "id": "i-wonyeong-1910",
  "name": "이원영",
  "birth_year": 1910,
  "external_ids": {
    "assembly_mona_cd": "8QD51451"
  },
  "career": [],
  "education": [],
  "source_urls": [
    "https://open.assembly.go.kr/portal/data/service/selectServicePage.do/OOWY4R001216HX11439"
  ],
  "verified": false,
  "checked_at": "2026-10-22"
}
