{
  "id": "baek-jongheon-1962",
  "name": "백종헌",
  "birth_year": 1962,
  "external_ids": {
    "assembly_mona_cd": "CAA7713A",
    "nec_huboids": [
      "100152536"
    ]
  },
  "career": [],
  "education": [],
  "source_urls": [
    "https://www.data.go.kr/data/15000864/openapi.do"
  ],
  "verified": false,
  "checked_at": "2026-10-21"
}
