{
  "id": "i-jangu-1965",
  "name": "이장우",
  "birth_year": 1965,
  "external_ids": {
    "assembly_mona_cd": "2SE64657"
  },
  "career": [],
  "education": [],
  "source_urls": [
    "https://open.assembly.go.kr/portal/data/service/selectServicePage.do/OOWY4R001216HX11439"
  ],
  "verified": false,
  "checked_at": "2026-10-22"
}
