{
  "id": "gim-hyeongdong-1975",
  "name": "김형동",
  "birth_year": 1975,
  "external_ids": {
    "assembly_mona_cd": "JEZ3130Q",
    "nec_huboids": [
      "100152920"
    ]
  },
  "career": [
    {
      "text": "(현)법무법인 중앙법률원 대표 변호사",
      "from": null,
      "to": null,
      "source_urls": [
        "http://info.nec.go.kr/electioninfo/electionInfo_report.xhtml?electionId=0000000000&requestURI=%2Felectioninfo%2F0000000000%2Fep%2Fepei01.jsp&topMenuId=EP&secondMenuId=EPEI01&menuId=EPEI01&statementId=EPEI01_%231&oldElectionType=1&electionType=2&electionName=20200415&electionCode=2&cityCode=4700&proportionalRepresentationCode=-1&townCode=-1&sggCityCode=-1&x=0&y=0"
      ]
    },
    {
      "text": "(현)노동법이론 실무학회 이사",
      "from": null,
      "to": null,
      "source_urls": [
        "http://info.nec.go.kr/electioninfo/electionInfo_report.xhtml?electionId=0000000000&requestURI=%2Felectioninfo%2F0000000000%2Fep%2Fepei01.jsp&topMenuId=EP&secondMenuId=EPEI01&menuId=EPEI01&statementId=EPEI01_%231&oldElectionType=1&electionType=2&electionName=20200415&electionCode=2&cityCode=4700&proportionalRepresentationCode=-1&townCode=-1&sggCityCode=-1&x=0&y=0"
      ]
    },
    {
      "text": "(현) 제21대 국회의원(안동시예천군)",
      "from": null,
      "to": null,
      "source_urls": [
        "https://www.data.go.kr/data/15000864/openapi.do"
      ]
    },
    {
      "text": "(현) 국민의힘 한동훈 비상대책위원장 비서실장",
      "from": null,
      "to": null,
      "source_urls": [
        "https://www.data.go.kr/data/15000864/openapi.do"
      ]
    }
  ],
  "education": [
    {
      "text": "서울대학교 사회과학대학 언론정보학과 졸업",
      "from": null,
      "to": null,
      "source_urls": [
        "http://info.nec.go.kr/electioninfo/electionInfo_report.xhtml?electionId=0000000000&requestURI=%2Felectioninfo%2F0000000000%2Fep%2Fepei01.jsp&topMenuId=EP&secondMenuId=EPEI01&menuId=EPEI01&statementId=EPEI01_%231&oldElectionType=1&electionType=2&electionName=20200415&electionCode=2&cityCode=4700&proportionalRepresentationCode=-1&townCode=-1&sggCityCode=-1&x=0&y=0"
      ]
    },
    {
      "text": "서울대학교 언론정보학과 졸업",
      "from": null,
      "to": null,
      "source_urls": [
        "https://www.data.go.kr/data/15000864/openapi.do"
      ]
    }
  ],
  "source_urls": [
    "https://www.data.go.kr/data/15000864/openapi.do"
  ],
  "verified": false,
  "checked_at": "2026-10-22"
}
